217;ZnO long fibers: large scale fabrication, precursor and the transformation process, microstructure and catalytic performance;WOS:000345651600022
218;Fabrication of Zirconia Fibers by a Sol-Gel Combined Rotational Centrifugal Spinning Technique;WOS:000342287100007
219;Centrifugal Spinning: An Alternative Approach to Fabricate Nanofibers at High Speed and Low Cost;WOS:000341654300004
220;Parameter study and characterization for polyacrylonitrile nanofibers fabricated via centrifugal spinning process;WOS:000328663800009
221;Morphological aspects of polymer fiber mats obtained by air flow rotary-jet spinning;WOS:000325108400017
222;Electro-Induced Coating of Chitosan on Centrifugal Spun Matrix - A Hybrid Composite for Biomedical Applications;WOS:000326364000005
223;Forming of Polymer Nanofibers by a Pressurised Gyration Process;WOS:000325870200002
224;Preparation of nanocrystalline titanium dioxide fibers using sol-gel method and centrifugal spinning;WOS:000315628200021
226;Preparation of High-Quality Zirconia Fibers by Super-High Rotational Centrifugal Spinning of Inorganic Sol;WOS:000314633100004
227;Assembly of Oriented Ultrafine Polymer Fibers by Centrifugal Electrospinning;WOS:000327698400001
228;A simple model for nanofiber formation by rotary jet-spinning;WOS:000297786500056
229;Fabrication of polymer fiber scaffolds by centrifugal spinning for cell culture studies;WOS:000293663400016
230;A simple and high production rate manufacturing method for submicron polymer fibres;WOS:000294164500010
231;Preparation of TiO2 Continuous Fibers with Oxygen Vacancies and Photocatalytic Activity;WOS:000297010500016
232;Microtomographic Porosity Determination in Alginate Mixed with Various Methods;WOS:000290119000010
233;Nanofiber Assembly by Rotary Jet-Spinning;WOS:000278449200048
234;Si-doped mesoporous TiO2 continuous fibers: Preparation by centrifugal spinning and photocatalytic properties;WOS:000273984000020
236;Preparation, microstructure and properties of yttrium aluminum garnet fibers prepared by sol-gel method;WOS:000262343500008
237;Polymer nanofibers via nozzle-free centrifugal spinning;WOS:000254911200037
238;An alumina mat with a nano microstructure prepared by centrifugal spinning method;WOS:000239268500016
239;Preparation of carbon nanotubes by centrifugal spinning of coreshell polymer particles;WOS:000230983000028
240;Centrifugally spun polyhydroxybutyrate fibres: accelerated hydrolytic degradation studies;WOS:000225743400001
241;TiO2 loaded mesoporous silica fiber for the photocatalytic application;WOS:000227357207073
243;Investigating the properties of novel poly(2-hydroxyethyl methacrylate-co-methyl methacrylate) hydrogel hollow fiber membranes;WOS:000172323700047
244;Adhesion measurements for electrostatic powder coatings;WOS:A1997XB34000040
245;Isolation and purification of fumonisin B-1 and B-2 from rice culture;WOS:A1996BF55A00010
246;Lubricious-surface-silicon-nitride rings for high-temperature tribological applications;WOS:A1996TQ20200005
247;PRODUCTION OF FLAKY CU-BASED AMORPHOUS POWDERS BY A 2-STAGE QUENCHING TECHNIQUE, AND THEIR CHEMICAL AND OPTICAL-PROPERTIES;WOS:A1994NR22900147
248;COMPOSITION AND STRUCTURE OF PRODUCTS FROM HIGH-SPEED STEEL IMPACT-CENTRIFUGAL SPINNING;WOS:A1993PA19500001
249;FLAKY AMORPHOUS POWDERS IN FE-BASED, CO-BASED AND AL-BASED SYSTEMS PREPARED BY A 2-STAGE QUENCHING TECHNIQUE;WOS:A1991FG70300162
250;PRODUCTION OF FLAKY AMORPHOUS ALLOY POWDERS IN CO-SI-B SYSTEM BY A 2-STAGE QUENCHING TECHNIQUE OF GAS ATOMIZATION AND CENTRIFUGAL SPINNING;WOS:A1989U820800002
