;Article Title;UT (Unique WOS ID)
0;Research on rotary nozzle structure and flow field of the spinneret for centrifugal spinning;WOS:000637895800001
1;Recent developments in centrifugally spun composite fibers and their performance as anode materials for lithium-ion and sodium-ion batteries;WOS:000621174300007
2;Centrifugally spun SnSb nanoparticle/porous carbon fiber composite as high-performance lithium-ion battery anode;WOS:000615985800010
3;A Review on Centrifugally Spun Fibers and Their Applications;WOS:000632012600001
4;Polycaprolactone/Beta-Tricalcium Phosphate Scaffolds Obtained via Rotary Jet-Spinning: in vitro and in vivo Evaluation;WOS:000627435000001
6;Antibacterial activities of centrifugally spun polyethylene oxide/silver composite nanofibers;WOS:000618885700001
7;Thermal conductivity of hybrid multilayer graphene-fiber carbon membranes;WOS:000615559700005
8;A simple, green chemistry technology for fabrication of tissue-engineered scaffolds based on mussel-inspired 3D centrifugal spun;WOS:000619124500001
9;Recent progress and challenges in solution blow spinning;WOS:000618243600007
10;Flexible polyethylene glycol/polyvinylpyrrolidone composite phase change fibres: Preparation, characterization, and thermal conductivity enhancement;WOS:000609875400001
11;Polyamidoxime nanoparticles/polyvinyl alcohol composite chelating nanofibers prepared by centrifugal spinning for uranium extraction;WOS:000618758600002
12;Centrifugally spun TiO2/C composite fibers prepared from TiS2/PAN precursor fibers as binder-free anodes for LIBS;WOS:000596306700035
13;Orientated and diameter-controlled fibrous scaffolds fabricated using the centrifugal electrospinning technique for stimulating the behaviours of fibroblast cells;WOS:000635992600001
14;Preparation and Characterization of Flexible Smart Glycol/Polyvinylpyrrolidone/Nano-Al2O3 Phase Change Fibers;WOS:000609088800074
15;Fabrication and properties of carboxymethyl chitosan/polyethylene oxide composite nonwoven mats by centrifugal spinning;WOS:000582801500050
16;Centrifugally spun carbon fibers prepared from aqueous poly(vinylpyrrolidone) solutions as binder-free anodes in lithium-ion batteries;WOS:000603653500001
17;Stable Zirconium Carbide Fibers Fabricated by Centrifugal Spinning Technique;WOS:000592928500012
20;Properties of non-woven polylactic acid fibers prepared by the rotational jet spinning method;WOS:000612955400002
21;Centrifugal spun osteoconductive ultrafine fibrous mat as a scaffold for bone regeneration;WOS:000601051200003
22;Jet evolution and fiber formation mechanism of amylopectin rich starches in centrifugal spinning system;WOS:000589628400001
24;Centrifugal Electrospinning Enables the Production of Meshes of Ultrathin Polymer Fibers;WOS:000592755800003
25;A novel facile preparation method of self-polarized Poly(vinylidene fluorides) nanofiber for high-performance piezoelectric nanogenerator;WOS:000579906400018
26;Centrifugally spun mats based on biopolyesters/hydroxyapatite and their potential as bone scaffolds;WOS:000583190200001
27;A dual-phase scaffold produced by rotary jet spinning and electrospinning for tendon tissue engineering;WOS:000576448300001
28;Development of laboratory-scale high-speed rotary devices for a potential pharmaceutical microfibre drug delivery platform;WOS:000577558900004
29;Advances in Functional Polymer Nanofibers: From Spinning Fabrication Techniques to Recent Biomedical Applications;WOS:000582345700001
30;Biomimetic and estrogenic fibers promote tissue repair in mice and human skin via estrogen receptor beta;WOS:000555693800005
31;Spinning solution flow model in the nozzle and experimental study of nanofibers fabrication via high speed centrifugal spinning;WOS:000571683000006
32;Water-born 3Dnanofiber mats usingcost-effectivecentrifugal spinning: comparison with electrospinnig process: A complex study;WOS:000571203400001
33;A Simple Drug Delivery System for Platelet-Derived Bioactive Molecules, to Improve Melanocyte Stimulation in Vitiligo Treatment;WOS:000580925000001
34;Influence of electrospinning methods on characteristics of polyvinyl butyral and polyurethane nanofibres essential for biological applications;WOS:000571737900008
35;Production of polyacrylonitrile nanofibres modified with Cyanex 272 for recovery of gallium from solution;WOS:000557596100001
36;Rotary-jet spun polycaprolactone/nano-hydroxyapatite scaffolds modified by simulated body fluid influenced the flexural mode of the neoformed bone;WOS:000552682800001
37;Low-cost hybrid scaffolds based on polyurethane and gelatin;WOS:000560691900004
38;Preparation and Characterization of Poly(lactic acid) Micro- and Nanofibers Fabricated by Centrifugal Spinning;WOS:000552732800004
39;Evaluation of filter media covered with spun fibres and containing thyme essential oil with antimicrobial properties;WOS:000550027000001
40;Processing-structure-property relationships of biopolyester/zinc oxide fibrous scaffolds engineered by centrifugal spinning;WOS:000544490800001
41;Nitrogen-doped TiO2 fibers for visible-light-induced photocatalytic activities;WOS:000533512000119
42;A comprehensive mathematical model for nanofibre formation in centrifugal spinning methods;WOS:000525104200001
43;Photocatalytic Degradation of Rhodamine B Using Carbon-Doped Carbon Nitride under Visible Light;WOS:000548252800002
44;X-ray Visualization and Quantification Using Fibrous Color Dosimeter Based on Leuco Dye;WOS:000543385900135
45;A comparison between electrospinning and rotary-jet spinning to produce PCL fibers with low bacteria colonization;WOS:000527396600003
46;Electrophoretic deposition of chitosan/nano silver embedded micro sphere on centrifugal spun fibrous matrices - A facile biofilm resistant biocompatible material;WOS:000522094600008
47;Recent advances in nanofibrous membranes: Production and applications in water treatment and desalination;WOS:000509615300001
48;Influence of Polymer Concentration and Nozzle Material on Centrifugal Fiber Spinning;WOS:000525952000074
49;Centrifugally spun porous carbon microfibers as interlayer for Li-S batteries;WOS:000509689700027
50;Advances in the scaffolds fabrication techniques using biocompatible polymers and their biomedical application: A technical and statistical review;WOS:000514799200002
51;A study of rheological limitations in rotary jet spinning of polymer nanofibers through modeling and experimentation;WOS:000508085700001
52;High-efficiency preparation of polypropylene nanofiber by melt differential centrifugal electrospinning;WOS:000489331500009
53;Polyacrylonitrile/polyethylene glycol phase-change material fibres prepared with hybrid polymer blends and nano-SiC fillers via centrifugal spinning;WOS:000513004500056
54;Investigation on the Polymer Drawing Model of the Centrifugal Spinning;WOS:000529832000006
55;A comparative study on SiO2 nanofiber production via two novel non-electrospinning methods: Centrifugal spinning vs solution blowing;WOS:000500934600002
56;PVAm Nanofibers Fabricated by Rotary Jet Wet Spinning and Applied to Bisphenol A Recognition;WOS:000503370500056
57;Preparation and properties of polystyrene/silica fibres flexible thermal insulation materials by centrifugal spinning;WOS:000501721600033
58;Porous Biomimetic Hyaluronic Acid and Extracellular Matrix Protein Nanofiber Scaffolds for Accelerated Cutaneous Tissue Repair;WOS:000502689000013
59;Cotton candy driven chitosan and gelatin coated poly(styrene-co-acrylonitrile) microfibers for anti-microbial wound dressing applications;WOS:000516852900007
60;Experimental and theoretical investigation of the fluid behavior during polymeric fiber formation with and without pressure;WOS:000515153700013
61;High-modulus rotary jet spun co-polyimide nanofibers and their composites;WOS:000494422500001
62;Fabrication of centrifugally spun prepared poly(lactic acid)/gelatin/ciprofloxacin nanofibers for antimicrobial wound dressing;WOS:000498861100002
63;N?Si doped carbon-embedded TiO2 composite fibers: a new photocatalysts with high yields by centrifugal spinning;WOS:000499880700001
64;In situ synthesis of Fe3O4-reinforced carbon fiber composites as anodes in lithium-ion batteries;WOS:000482115200003
65;Centrifugally Spun alpha-Fe2O3/TiO2/Carbon Composite Fibers as Anode Materials for Lithium-Ion Batteries;WOS:000496258100090
66;High Efficiency Fabrication of Chitosan Composite Nanofibers with Uniform Morphology via Centrifugal Spinning;WOS:000495382700019
67;Facile and Scalable Fabrication of Porous Polystyrene Fibers for Oil Removal by Centrifugal Spinning;WOS:000489241700026
68;Polyurethane fibrous membranes tailored by rotary jet spinning for tissue engineering applications;WOS:000486734900001
69;Scalable manufacturing and applications of nanofibers;WOS:000484406100023
70;Preparation and properties of polyacrylonitrile/polyethylene glycol composite fibers phase change materials by centrifugal spinning;WOS:000474203200001
71;Synthesis of multiwall alpha-Fe2O3 hollow fibers via a centrifugal spinning technique;WOS:000472241700053
72;A Comparative Study on Properties of Cellulose/Antarctic Krill Protein Composite Fiber by Centrifugal Spinning and Wet Spinning;WOS:000483661500001
73;Interpenetrating-Syncretic Micro-Nano Hierarchy Fibers for Effective Fine Particle Capture;WOS:000481868900001
74;A review on nanofiber fabrication with the effect of high-speed centrifugal force field;WOS:000478044100001
76;Recovery of indium from LCD screens using solid-phase extraction onto nanofibers modified with Di-(2-ethylhexyl) phosphoric acid (DEHPA);WOS:000474500100015
77;Sodium alginate/feather keratin-g-allyloxy polyethylene glycol composite phase change fiber;WOS:000468252800023
78;Forcespinning technique for the production of poly(d,l-lactic acid) submicrometer fibers: Process-morphology-properties relationship;WOS:000461569900029
79;Antibacterial activity of polymeric nanofiber membranes impregnated with Texas sour orange juice;WOS:000471736400001
80;Instability of non-Newtonian liquid jets in centrifugal spinning with surfactants;WOS:000470890900001
81;Centrifugally spun silica (SiO2) nanofibers for high-temperature air filtration;WOS:000469605000001
82;Fabrication and characterization of centrifugally spun poly(acrylic acid) nanofibers;WOS:000458360000014
83;Determining the effect of centrifugal and electrical forces on the jet behaviors, the nanofiber structure, and morphology;WOS:000461066000013
84;Needleless electrospun and centrifugal spun poly-epsilon-caprolactone scaffolds as a carrier for platelets in tissue engineering applications: A comparative study with hMSCs;WOS:000457952800054
85;Engineering hierarchical porous oxygen-deficient TiO2 fibers decorated with BiOCl nanosheets for efficient photocatalysis;WOS:000455471100009
86;The movement and forces of spinning solution in the nozzle during high-speed centrifugal spinning;WOS:000459378400001
87;Carbon-enhanced centrifugally-spun SnSb/carbon microfiber composite as advanced anode material for sodium-ion battery;WOS:000452937800068
88;In vitro and in vivo evaluation of rotary-jet-spun poly(-caprolactone) with high loading of nano-hydroxyapatite;WOS:000456957700001
89;Exploring the Polymer Drawing of the Air Centrifugal Spinning;WOS:000509983900005
90;Fibritary: Rotary Jet-Spinning for Personal Fiber Fabrication;WOS:000482042102022
91;Viability Assays of PLLA Fibrous Membranes Produced by Rotary Jet Spinning for Application in Tissue Engineering;WOS:000481712100001
92;Muscle tissue engineering in fibrous gelatin: implications for meat analogs;WOS:000618966900020
93;Rotary jet-spun porous microfibers as scaffolds for stem cells delivery to central nervous system injury;WOS:000452546700009
94;Centrifugally spun ultrafine starch/PEO fibres as release formulation for poorly water-soluble drugs;WOS:000454765100012
95;Development of antimicrobial chitosan based nanofiber dressings for wound healing applications;WOS:000430258000002
96;Micro-Nanofibrillar Polycaprolactone Scaffolds as Translatable Osteoconductive Grafts for the Treatment of Musculoskeletal Defects without Infection;WOS:000616365700039
97;A viscoelastic beam theory of polymer jets with application to rotary jet spinning;WOS:000451758600005
98;Poly(Lactic Acid) Fine Fibers Containing a Low Content of Superhydrophilic Multi-Walled Carbon Nanotube Graphene Oxide Hybrid as Scaffolds for Biological Applications;WOS:000449883100008
99;High-Throughput Production With Improved Functionality and Graphitization of Carbon Fine Fibers Developed from Sodium Chloride-Polyacrylonitrile Precursors;WOS:000449949600017
100;Development of Nanofibers Composed of Chitosan/Nylon 6 and Tannin/Nylon 6 for Effective Adsorption of Cr(VI);WOS:000446384000006
101;Research on modeling, simulation and experiment based on centrifugal spinning method;WOS:000445193600003
102;Texas Sour Orange Juice Used in Scaffolds for Tissue Engineering;WOS:000447933400004
103;Centrifugally spun of alginate-riched submicron fibers from alginate/polyethylene oxide blends;WOS:000447874000023
104;Nanofibrous scaffolds produced by electrospinning, rotary-jet spinning and airbrush for orthopedic tissue regeneration;WOS:000447600003733
105;Nanofiber-reinforced soft fluidic micro-actuators;WOS:000432871300001
106;Variation in Nanofiber-Collection Location Depending on Process Variables for Centrifugal Spinning System;WOS:000446518700003
107;High-performance SnSb@rGO@CMF composites as anode material for sodium-ion batteries through high-speed centrifugal spinning;WOS:000432672300036
109;Protein-Based Fiber Materials in Medicine: A Review;WOS:000442523100008
110;Influence of spinning parameters on synthesis of alumina fibres by centrifugal spinning;WOS:000432768200077
111;Production-scale fibronectin nanofibers promote wound closure and tissue repair in a dermal mouse model;WOS:000430028900008
112;Highly-efficient Fabrication and Crystallinity and Orientation of Polyacrylonitrile Nanofibers;WOS:000439430300012
113;Centrifugally Spun Recycled PET: Processing and Characterization;WOS:000436560200117
114;Fabrication and Characterization of Poly(L-lactic Acid) Fiber Mats Using Centrifugal Spinning;WOS:000437774000015
115;PA6 Nanofibre Production: A Comparison between Rotary Jet Spinning and Electrospinning;WOS:000436551800020
116;Development and optimization of alumina fine fibers utilizing a centrifugal spinning process;WOS:000429395200019
117;Soy Protein/Cellulose Nanofiber Scaffolds Mimicking Skin Extracellular Matrix for Enhanced Wound Healing;WOS:000431960000004
118;Stability and spinnability of modified melamine-formaldehyde resin solution for centrifugal spinning;WOS:000418868800007
119;Research on parametric model for polycaprolactone nanofiber produced by centrifugal spinning;WOS:000430239300044
120;Effects of water vapor on the crystallization and microstructure manipulation of MgO ceramic fibers;WOS:000425204400096
121;A method for controlling the surface morphology of centrifugally spun starch-based fibers;WOS:000413925200019
122;Development of Carbon Nanofiber Yarns by Electrospinning;WOS:000461176700027
123;Preparation and performance of novel polyvinylpyrrolidone/polyethylene glycol phase change materials composite fibers by centrifugal spinning;WOS:000418590200052
124;Development of Cotton Candy Method for High Productivity Polypropylene Fibers Webs;WOS:000423720800014
125;AIR VELOCITY DISTRIBUTION OF THE CIRCUMFERENTIALLY ARRANGED NOZZLE GROUP;WOS:000441484800006
127;Optimization of centrifugally spun thermoplastic polyurethane nanofibers for air filtration applications;WOS:000430091700004
128;Numerical and experimental study on the steady cone-jet mode of electro-centrifugal spinning (vol 30, 017103, 2018);WOS:000424017600067
129;Numerical and experimental study on the steady cone-jet mode of electro-centrifugal spinning;WOS:000424017600064
130;Morphological Comparison of Aligned Poly(vinyl alcohol) Nanofibers Fabricated by Modified Electrospinning and Centrifugal Jet Spinning Techniques;WOS:000417111000050
131;Nanofibrous Scaffolds Produced by Electrospinning, Rotary-Jet Spinning and Airbrush for Orthopedic Tissue Regeneration;WOS:000416247300336
132;Electrostatic-assisted centrifugal spinning for continuous collection of submicron fibers;WOS:000412813000005
133;Microstructure and electrochemical properties of polyacrylonitrile-based carbon micro- and nanofibers fabricated by centrifugal spinning;WOS:000407404400003
134;Discretized modeling for centrifugal spinning of viscoelastic liquids;WOS:000412040900006
136;In Situ Production of Graphene-Fiber Hybrid Structures;WOS:000407089300046
137;SiO2 Fibers by Centrifugal Spinning with Excellent Textural Properties and Water Adsorption Performance;WOS:000409924000108
138;Regularized string model for nanofibre formation in centrifugal spinning methods;WOS:000403090300015
139;Centrifugally spun PHBV micro and nanofibres;WOS:000405541600023
140;JetValve: Rapid manufacturing of biohybrid scaffolds for biomimetic heart valve replacement;WOS:000401716700020
141;Microfibrous Solid Dispersions of Poorly Water-Soluble Drugs Produced via Centrifugal Spinning: Unexpected Dissolution Behavior on Recrystallization;WOS:000400633300033
143;Centrifugal micro-channel array droplet generation for highly parallel digital PCR;WOS:000393980400003
144;Highly porous fibers prepared by centrifugal spinning;WOS:000390650800038
145;Production of Synthetic, Para-Aramid and Biopolymer Nanofibers by Immersion Rotary Jet-Spinning;WOS:000396394700008
148;Rotary jet spinning review - a potential high yield future for polymer nanofibers;WOS:000424579900001
149;A comparison of high throughput core-shell 2D electrospinning and 3D centrifugal spinning techniques to produce platelet lyophilisate-loaded fibrous scaffolds and their effects on skin cells;WOS:000416831000007
150;Production of rotary jet spun ultrathin fibers of poly-butylene adipate-co- terephthalate (PBAT) filled with nanocomposites;WOS:000417112700023
151;A COMPARISON OF THE CENTRIFUGAL FORCE SPINNING AND ELECTROSPINNING OF COLLAGEN UNDER DIFFERENT CONDITIONS;WOS:000410656100090
152;Research on the development of the centrifugal spinning;WOS:000406705800063
153;Fabrication of Water Glass Fibers by Centrifugal Spinning and Characterization of Their Thermal Conductivity as a Heat-Insulator;WOS:000405524100002
154;Preparation of SiO2/PS superhydrophobic fibers with bionic controllable micro-nano structure via centrifugal spinning;WOS:000395796700054
155;Emulsion centrifugal spinning for production of 3D drug releasing nanofibres with core/shell structure;WOS:000393744400003
156;Platelet-functionalized three-dimensional polye-epsilon-caprolactone fibrous scaffold prepared using centrifugal spinning for delivery of growth factors;WOS:000391321000001
157;Large scale fabrication of magnesium oxide fibers for high temperature thermal structure applications;WOS:000390737100078
158;Porous polycaprolactone fibers made by centrifugal spinning;WOS:000570135000004
159;Centrifugal Spinning: An Alternative for Large Scale Production of Silicon-Carbon Composite Nanofibers for Lithium Ion Battery Anodes;WOS:000387095300020
160;Development of Molecular Anisotropy in Centrifugally Spun Fibers as Compared to Electrospun Fibers;WOS:000386924000005
161;Centrifugally-spun carbon microfibers and porous carbon microfibers as anode materials for sodium-ion batteries;WOS:000383003600036
163;Fibers from single and mixed waste streams using melt centrifugal spinning;WOS:000431460403446
164;Development of biocomposites by a facile fiber spinning technique for nerve tissue engineering applications;WOS:000380282200003
165;Centrifugal melt spinning of polyvinylpyrrolidone (PVP)/triacontene copolymer fibres;WOS:000378542300012
166;Tailoring Supramolecular Nanofibers for Air Filtration Applications;WOS:000378195000071
167;Effect of Polymer Concentration, Rotational Speed, and Solvent Mixture on Fiber Formation Using Forcespinning((R));WOS:000380256100009
168;Development of micro-fibrous solid dispersions of poorly water-soluble drugs in sucrose using temperature-controlled centrifugal spinning;WOS:000376785800009
169;Polyhedral Oligomeric Silsesquioxane-Containing Thiol-ene Fibers with Tunable Thermal and Mechanical Properties;WOS:000375520700048
170;Preparation and low-temperature gas-sensing properties of SnO2 ultra-fine fibers fabricated by a centrifugal spinning process;WOS:000372875200016
171;Comparing the structures and sodium storage properties of centrifugally spun SnO2 microfiber anodes with/without chemical vapor deposition;WOS:000370342100035
172;Preparation and characterization of hollow Fe2O3 ultra-fine fibers by centrifugal spinning;WOS:000371296000055
173;A comparative parameter study: Controlling fiber diameter and diameter distribution in centrifugal spinning of photocurable monomers;WOS:000372323400012
174;Forcespinning: A new method for the mass production of Sn/C composite nanofiber anodes for lithium ion batteries;WOS:000372388400012
175;Centrifugally spun starch-based fibers from amylopectin rich starches;WOS:000366938200053
176;Hollow carbon microfibres fabricated using coaxial centrifugal spinning;WOS:000371354700003
177;Preparation, ferromagnetic and photocatalytic performance of NiO and hollow Co3O4 fibers through centrifugal-spinning technique;WOS:000367775000047
178;Fibrous scaffolds for building hearts and heart parts;WOS:000370095000008
179;Study on Carbon Nano Fiber by Cotton Candy Method;WOS:000392267800051
180;Immobilisation of Endoinulinase on Polyhydroxybutyrate Microfibres;WOS:000390687500009
181;Centrifugally Spun SnO2 Microfibers Composed of Interconnected Nanoparticles as the Anode in Sodium-Ion Batteries;WOS:000368364700013
182;The jetting behavior of viscoelastic Boger fluids during centrifugal spinning;WOS:000367459300011
183;Preparation and photoelectric properties of indium tin oxide depositional optical fiber by centrifugal spinning;WOS:000362663300097
184;lithium-substituted sodium layered transition metal oxide fibers as cathodes for sodium-ion batteries;WOS:000393519400009
185;Manipulating characteristic timescales and fiber morphology in simultaneous centrifugal spinning and photopolymerization;WOS:000360071300006
186;Functional Copolymer/Organo-MMT Nanoarchitectures. XXII. Fabrication and Characterization of Antifungal and Antibacterial Poly (Vinyl Alcohol-co-Vinyl Acetate/ODA-MMT/AgNPs Nanofibers and Nanocoatings by e-Spinning and c-Spinning Methods;WOS:000343994000005
187;Facile one-pot formation of ceramic fibres from preceramic polymers by pressurised gyration;WOS:000350513700107
189;Electrophoretic deposition of chitosan: A rapid surface modification technique for centrifugal spun fibrous web;WOS:000349988900005
190;Experimental and numerical study on isolated and non-isolated jet behavior through centrifuge spinning system;WOS:000348269400009
191;A Modified Electro-Centrifugal Spinning Method to Enhance the Production Rate of Highly Aligned Nanofiber;WOS:000352110300001
192;Effective method for high-throughput manufacturing of ultrafine fibres via needleless centrifugal spinning;WOS:000350483000006
193;Rotary jet-spinning of hematite fibers;WOS:000348911900009
194;Centrifugally-spun tin-containing carbon nanofibers as anode material for lithium-ion batteries;WOS:000346777800008
195;Formation of Melt and Solution Spun Polycaprolactone Fibers by Centrifugal Spinning;WOS:000343810700030
196;Melt centrifugal spinning of biocompatible and biodegradable polymers;WOS:000380587500013
197;A comparison of centrifugally-spun and electrospun regenerated silk fibroin nanofiber structures and properties;WOS:000365403000081
198;PRODUCTION OF SCAFFOLDS FOR ARTIFICAL CARTILAGE BY CENTRIFUGAL SPINNING;WOS:000350636300095
199;IMMOBILIZATION OF MICROORGANISMS IN FIBERS;WOS:000350636300102
200;Centrifugal spinning: A novel approach to fabricate porous carbon fibers as binder-free electrodes for electric double-layer capacitors;WOS:000345725700063
201;SiO2/polyacrylonitrile membranes via centrifugal spinning as a separator for Li-ion batteries;WOS:000345725700139
202;Fabrication of Discontinuous Al2O3-Dispersed TZP Fibers by a Sol-Gel Method;WOS:000435261200010
203;Hierarchical structures constructed by BiOX (X = Cl, I) nanosheets on CNTs/carbon composite fibers for improved photocatalytic degradation of methyl orange;WOS:000346697000031
204;A Comparative Study of Jet Formation in Nozzle- and Nozzle-Less Centrifugal Spinning Systems;WOS:000344361500005
205;Calcium Cl/OH-apatite, Cl/OH-apatite/Al2O3 and Ca-3(PO4)(2) fibre nonwovens: Potential ceramic components for osteosynthesis;WOS:000340976200060
206;Effect of Solvent Evaporation on Fiber Morphology in Rotary Jet Spinning;WOS:000344905100029
207;Nanofiber Fabrication Techniques and Its Applicability to Chitosan;WOS:000346224000007
208;Fabrication of highly aligned fibrous scaffolds for tissue regeneration by centrifugal spinning technology;WOS:000340687400099
209;Titanium dioxide fibers prepared by sol-gel process and centrifugal spinning;WOS:000337288100014
210;Wide spectral response and enhanced photocatalytic activity of TiO2 continuous fibers modified with aminosilane coupling agents;WOS:000333411100006
211;Regularized thin-fiber model for nanofiber formation by centrifugal spinning (vol 89, 023011, 2014);WOS:000342216100007
212;The combination of electrospinning and forcespinning: Effects on a viscoelastic jet and a single nanofiber;WOS:000334134700064
213;Ultra-fine liquid crystal fibers formed via centrifugal spinning;WOS:000348457604278
215;Regularized thin-fiber model for nanofiber formation by centrifugal spinning;WOS:000332178600004
216;Influence of nanotube dispersion and spinning conditions on nanofibre nanocomposites of polypropylene and multi-walled carbon nanotubes produced through Forcespinning (TM);WOS:000329423800005
